    1 0.000000000 130.215.126.234 → 130.215.248.198 TCP 67 35828 → 5201 [PSH, ACK] Seq=1 Ack=1 Win=502 Len=1[Packet size limited during capture]
    2 0.007223487 130.215.248.198 → 130.215.126.234 TCP 67 5201 → 35828 [PSH, ACK] Seq=1 Ack=2 Win=508 Len=1[Packet size limited during capture]
    3 0.007389356 130.215.126.234 → 130.215.248.198 TCP 70 35828 → 5201 [PSH, ACK] Seq=2 Ack=2 Win=502 Len=4[Packet size limited during capture]
    4 0.007450320 130.215.126.234 → 130.215.248.198 TCP 392 35828 → 5201 [PSH, ACK] Seq=6 Ack=2 Win=502 Len=326[Packet size limited during capture]
    5 0.012999480 130.215.248.198 → 130.215.126.234 TCP 66 5201 → 35828 [ACK] Seq=2 Ack=332 Win=506 Len=0[Packet size limited during capture]
    6 0.013062792 130.215.248.198 → 130.215.126.234 TCP 70 5201 → 35828 [PSH, ACK] Seq=2 Ack=332 Win=506 Len=4[Packet size limited during capture]
    7 0.013087315 130.215.248.198 → 130.215.126.234 TCP 392 5201 → 35828 [PSH, ACK] Seq=6 Ack=332 Win=506 Len=326[Packet size limited during capture]
    8 0.013109850 130.215.248.198 → 130.215.126.234 TCP 67 5201 → 35828 [PSH, ACK] Seq=332 Ack=332 Win=506 Len=1[Packet size limited during capture]
    9 0.013162249 130.215.126.234 → 130.215.248.198 TCP 66 35828 → 5201 [ACK] Seq=332 Ack=333 Win=501 Len=0[Packet size limited during capture]
   10 0.013193543 130.215.126.234 → 130.215.248.198 TCP 66 35834 → 5201 [FIN, ACK] Seq=1 Ack=1 Win=502 Len=0[Packet size limited during capture]
   11 0.013249392 130.215.126.234 → 130.215.248.198 TCP 67 35828 → 5201 [PSH, ACK] Seq=332 Ack=333 Win=501 Len=1[Packet size limited during capture]
   12 0.013271607 130.215.126.234 → 130.215.248.198 TCP 66 35828 → 5201 [FIN, ACK] Seq=333 Ack=333 Win=501 Len=0[Packet size limited during capture]
   13 0.019525666 130.215.248.198 → 130.215.126.234 TCP 66 5201 → 35834 [FIN, ACK] Seq=1 Ack=2 Win=1868 Len=0[Packet size limited during capture]
   14 0.019624462 130.215.126.234 → 130.215.248.198 TCP 66 35834 → 5201 [ACK] Seq=2 Ack=2 Win=502 Len=0[Packet size limited during capture]
   15 0.023101345 130.215.248.198 → 130.215.126.234 TCP 66 5201 → 35828 [FIN, ACK] Seq=333 Ack=334 Win=506 Len=0[Packet size limited during capture]
   16 0.023171876 130.215.126.234 → 130.215.248.198 TCP 66 35828 → 5201 [ACK] Seq=334 Ack=334 Win=501 Len=0[Packet size limited during capture]
