    1 0.000000000 130.215.126.234 → 130.215.248.198 TCP 1014 45102 → 5201 [PSH, ACK] Seq=1 Ack=1 Win=502 Len=948[Packet size limited during capture]
    2 0.027295152 130.215.248.198 → 130.215.126.234 TCP 66 5201 → 45102 [ACK] Seq=1 Ack=4294823447 Win=3395 Len=0[Packet size limited during capture]
    3 0.027343847 130.215.248.198 → 130.215.126.234 TCP 66 5201 → 45102 [ACK] Seq=1 Ack=4294824817 Win=3418 Len=0[Packet size limited during capture]
    4 0.027356861 130.215.248.198 → 130.215.126.234 TCP 66 5201 → 45102 [ACK] Seq=1 Ack=4294826187 Win=3440 Len=0[Packet size limited during capture]
    5 0.027368038 130.215.248.198 → 130.215.126.234 TCP 66 5201 → 45102 [ACK] Seq=1 Ack=4294827557 Win=3463 Len=0[Packet size limited during capture]
    6 0.027379006 130.215.248.198 → 130.215.126.234 TCP 66 5201 → 45102 [ACK] Seq=1 Ack=4294828927 Win=3485 Len=0[Packet size limited during capture]
    7 0.027389994 130.215.248.198 → 130.215.126.234 TCP 66 5201 → 45102 [ACK] Seq=1 Ack=4294830297 Win=3508 Len=0[Packet size limited during capture]
    8 0.027400997 130.215.248.198 → 130.215.126.234 TCP 66 5201 → 45102 [ACK] Seq=1 Ack=4294831667 Win=3531 Len=0[Packet size limited during capture]
    9 0.027412050 130.215.248.198 → 130.215.126.234 TCP 66 5201 → 45102 [ACK] Seq=1 Ack=4294833037 Win=3553 Len=0[Packet size limited during capture]
   10 0.027423015 130.215.248.198 → 130.215.126.234 TCP 66 5201 → 45102 [ACK] Seq=1 Ack=4294834407 Win=3576 Len=0[Packet size limited during capture]
   11 0.027434057 130.215.248.198 → 130.215.126.234 TCP 66 5201 → 45102 [ACK] Seq=1 Ack=4294835777 Win=3599 Len=0[Packet size limited during capture]
   12 0.027445161 130.215.248.198 → 130.215.126.234 TCP 66 5201 → 45102 [ACK] Seq=1 Ack=4294837147 Win=3621 Len=0[Packet size limited during capture]
   13 0.027455947 130.215.248.198 → 130.215.126.234 TCP 66 5201 → 45102 [ACK] Seq=1 Ack=4294838517 Win=3644 Len=0[Packet size limited during capture]
   14 0.027469011 130.215.248.198 → 130.215.126.234 TCP 66 5201 → 45102 [ACK] Seq=1 Ack=4294839887 Win=3666 Len=0[Packet size limited during capture]
   15 0.027479779 130.215.248.198 → 130.215.126.234 TCP 66 5201 → 45102 [ACK] Seq=1 Ack=4294841257 Win=3689 Len=0[Packet size limited during capture]
   16 0.027490388 130.215.248.198 → 130.215.126.234 TCP 66 5201 → 45102 [ACK] Seq=1 Ack=4294842627 Win=3712 Len=0[Packet size limited during capture]
   17 0.027501182 130.215.248.198 → 130.215.126.234 TCP 66 5201 → 45102 [ACK] Seq=1 Ack=4294843997 Win=3734 Len=0[Packet size limited during capture]
   18 0.027512110 130.215.248.198 → 130.215.126.234 TCP 66 5201 → 45102 [ACK] Seq=1 Ack=4294845367 Win=3757 Len=0[Packet size limited during capture]
   19 0.027522716 130.215.248.198 → 130.215.126.234 TCP 66 5201 → 45102 [ACK] Seq=1 Ack=4294846737 Win=3780 Len=0[Packet size limited during capture]
   20 0.027537486 130.215.248.198 → 130.215.126.234 TCP 66 5201 → 45102 [ACK] Seq=1 Ack=4294848107 Win=3802 Len=0[Packet size limited during capture]
   21 0.027565534 130.215.248.198 → 130.215.126.234 TCP 66 5201 → 45102 [ACK] Seq=1 Ack=4294849477 Win=3825 Len=0[Packet size limited during capture]
   22 0.027576937 130.215.248.198 → 130.215.126.234 TCP 66 5201 → 45102 [ACK] Seq=1 Ack=4294850847 Win=3847 Len=0[Packet size limited during capture]
   23 0.027587657 130.215.248.198 → 130.215.126.234 TCP 66 5201 → 45102 [ACK] Seq=1 Ack=4294852217 Win=3870 Len=0[Packet size limited during capture]
   24 0.027598347 130.215.248.198 → 130.215.126.234 TCP 66 5201 → 45102 [ACK] Seq=1 Ack=4294853587 Win=3893 Len=0[Packet size limited during capture]
   25 0.027610370 130.215.248.198 → 130.215.126.234 TCP 66 5201 → 45102 [ACK] Seq=1 Ack=4294854957 Win=3915 Len=0[Packet size limited during capture]
   26 0.027621031 130.215.248.198 → 130.215.126.234 TCP 66 5201 → 45102 [ACK] Seq=1 Ack=4294856327 Win=3938 Len=0[Packet size limited during capture]
   27 0.027631630 130.215.248.198 → 130.215.126.234 TCP 66 5201 → 45102 [ACK] Seq=1 Ack=4294857697 Win=3961 Len=0[Packet size limited during capture]
   28 0.027642749 130.215.248.198 → 130.215.126.234 TCP 66 5201 → 45102 [ACK] Seq=1 Ack=4294859067 Win=3983 Len=0[Packet size limited during capture]
   29 0.027653162 130.215.248.198 → 130.215.126.234 TCP 66 5201 → 45102 [ACK] Seq=1 Ack=4294860437 Win=4006 Len=0[Packet size limited during capture]
   30 0.027663875 130.215.248.198 → 130.215.126.234 TCP 66 5201 → 45102 [ACK] Seq=1 Ack=4294861807 Win=4028 Len=0[Packet size limited during capture]
   31 0.027674684 130.215.248.198 → 130.215.126.234 TCP 66 5201 → 45102 [ACK] Seq=1 Ack=4294863177 Win=4051 Len=0[Packet size limited during capture]
   32 0.027685111 130.215.248.198 → 130.215.126.234 TCP 66 5201 → 45102 [ACK] Seq=1 Ack=4294864547 Win=4074 Len=0[Packet size limited during capture]
   33 0.027695647 130.215.248.198 → 130.215.126.234 TCP 66 5201 → 45102 [ACK] Seq=1 Ack=4294865917 Win=4096 Len=0[Packet size limited during capture]
   34 0.029863075 130.215.248.198 → 130.215.126.234 TCP 66 5201 → 45102 [ACK] Seq=1 Ack=4294867287 Win=4119 Len=0[Packet size limited during capture]
   35 0.029884412 130.215.248.198 → 130.215.126.234 TCP 66 5201 → 45102 [ACK] Seq=1 Ack=4294868657 Win=4142 Len=0[Packet size limited during capture]
   36 0.029896942 130.215.248.198 → 130.215.126.234 TCP 66 5201 → 45102 [ACK] Seq=1 Ack=4294870027 Win=4164 Len=0[Packet size limited during capture]
   37 0.029910659 130.215.248.198 → 130.215.126.234 TCP 66 5201 → 45102 [ACK] Seq=1 Ack=4294871397 Win=4187 Len=0[Packet size limited during capture]
   38 0.029925601 130.215.248.198 → 130.215.126.234 TCP 66 5201 → 45102 [ACK] Seq=1 Ack=4294872767 Win=4209 Len=0[Packet size limited during capture]
   39 0.029936392 130.215.248.198 → 130.215.126.234 TCP 66 5201 → 45102 [ACK] Seq=1 Ack=4294874137 Win=4232 Len=0[Packet size limited during capture]
   40 0.029947331 130.215.248.198 → 130.215.126.234 TCP 66 5201 → 45102 [ACK] Seq=1 Ack=4294875507 Win=4255 Len=0[Packet size limited during capture]
   41 0.029958141 130.215.248.198 → 130.215.126.234 TCP 66 5201 → 45102 [ACK] Seq=1 Ack=4294876877 Win=4277 Len=0[Packet size limited during capture]
   42 0.029968690 130.215.248.198 → 130.215.126.234 TCP 66 5201 → 45102 [ACK] Seq=1 Ack=4294878247 Win=4300 Len=0[Packet size limited during capture]
   43 0.029991865 130.215.248.198 → 130.215.126.234 TCP 66 5201 → 45102 [ACK] Seq=1 Ack=4294879617 Win=4323 Len=0[Packet size limited during capture]
   44 0.030005262 130.215.248.198 → 130.215.126.234 TCP 66 5201 → 45102 [ACK] Seq=1 Ack=4294880987 Win=4345 Len=0[Packet size limited during capture]
   45 0.030016744 130.215.248.198 → 130.215.126.234 TCP 66 5201 → 45102 [ACK] Seq=1 Ack=4294882357 Win=4368 Len=0[Packet size limited during capture]
   46 0.030028865 130.215.248.198 → 130.215.126.234 TCP 66 5201 → 45102 [ACK] Seq=1 Ack=4294883727 Win=4390 Len=0[Packet size limited during capture]
   47 0.030040550 130.215.248.198 → 130.215.126.234 TCP 66 5201 → 45102 [ACK] Seq=1 Ack=4294885097 Win=4413 Len=0[Packet size limited during capture]
   48 0.030052254 130.215.248.198 → 130.215.126.234 TCP 66 5201 → 45102 [ACK] Seq=1 Ack=4294886467 Win=4436 Len=0[Packet size limited during capture]
   49 0.030063908 130.215.248.198 → 130.215.126.234 TCP 66 5201 → 45102 [ACK] Seq=1 Ack=4294887837 Win=4458 Len=0[Packet size limited during capture]
   50 0.030075368 130.215.248.198 → 130.215.126.234 TCP 66 5201 → 45102 [ACK] Seq=1 Ack=4294889207 Win=4481 Len=0[Packet size limited during capture]
   51 0.030087053 130.215.248.198 → 130.215.126.234 TCP 66 5201 → 45102 [ACK] Seq=1 Ack=4294890577 Win=4504 Len=0[Packet size limited during capture]
   52 0.030098584 130.215.248.198 → 130.215.126.234 TCP 66 5201 → 45102 [ACK] Seq=1 Ack=4294891947 Win=4526 Len=0[Packet size limited during capture]
   53 0.030110080 130.215.248.198 → 130.215.126.234 TCP 66 5201 → 45102 [ACK] Seq=1 Ack=4294893317 Win=4549 Len=0[Packet size limited during capture]
   54 0.030121849 130.215.248.198 → 130.215.126.234 TCP 66 5201 → 45102 [ACK] Seq=1 Ack=4294894687 Win=4571 Len=0[Packet size limited during capture]
   55 0.030133597 130.215.248.198 → 130.215.126.234 TCP 66 5201 → 45102 [ACK] Seq=1 Ack=4294896057 Win=4594 Len=0[Packet size limited during capture]
   56 0.030145327 130.215.248.198 → 130.215.126.234 TCP 66 5201 → 45102 [ACK] Seq=1 Ack=4294897427 Win=4617 Len=0[Packet size limited during capture]
   57 0.030157213 130.215.248.198 → 130.215.126.234 TCP 66 5201 → 45102 [ACK] Seq=1 Ack=4294898797 Win=4639 Len=0[Packet size limited during capture]
   58 0.030168981 130.215.248.198 → 130.215.126.234 TCP 66 5201 → 45102 [ACK] Seq=1 Ack=4294900167 Win=4662 Len=0[Packet size limited during capture]
   59 0.030180427 130.215.248.198 → 130.215.126.234 TCP 66 5201 → 45102 [ACK] Seq=1 Ack=4294901537 Win=4685 Len=0[Packet size limited during capture]
   60 0.030192285 130.215.248.198 → 130.215.126.234 TCP 66 5201 → 45102 [ACK] Seq=1 Ack=4294902907 Win=4707 Len=0[Packet size limited during capture]
   61 0.030205058 130.215.248.198 → 130.215.126.234 TCP 66 5201 → 45102 [ACK] Seq=1 Ack=4294904277 Win=4730 Len=0[Packet size limited during capture]
   62 0.030216594 130.215.248.198 → 130.215.126.234 TCP 66 5201 → 45102 [ACK] Seq=1 Ack=4294905647 Win=4752 Len=0[Packet size limited during capture]
   63 0.030229281 130.215.248.198 → 130.215.126.234 TCP 66 5201 → 45102 [ACK] Seq=1 Ack=4294907017 Win=4775 Len=0[Packet size limited during capture]
   64 0.030246065 130.215.248.198 → 130.215.126.234 TCP 66 5201 → 45102 [ACK] Seq=1 Ack=4294908387 Win=4798 Len=0[Packet size limited during capture]
   65 0.030258023 130.215.248.198 → 130.215.126.234 TCP 66 5201 → 45102 [ACK] Seq=1 Ack=4294909757 Win=4820 Len=0[Packet size limited during capture]
   66 0.030270046 130.215.248.198 → 130.215.126.234 TCP 66 5201 → 45102 [ACK] Seq=1 Ack=4294911127 Win=4843 Len=0[Packet size limited during capture]
   67 0.030281782 130.215.248.198 → 130.215.126.234 TCP 66 5201 → 45102 [ACK] Seq=1 Ack=4294912497 Win=4866 Len=0[Packet size limited during capture]
   68 0.030293371 130.215.248.198 → 130.215.126.234 TCP 66 5201 → 45102 [ACK] Seq=1 Ack=4294913867 Win=4888 Len=0[Packet size limited during capture]
   69 0.030305128 130.215.248.198 → 130.215.126.234 TCP 66 5201 → 45102 [ACK] Seq=1 Ack=4294915237 Win=4911 Len=0[Packet size limited during capture]
   70 0.030316833 130.215.248.198 → 130.215.126.234 TCP 66 5201 → 45102 [ACK] Seq=1 Ack=4294916607 Win=4933 Len=0[Packet size limited during capture]
   71 0.030328385 130.215.248.198 → 130.215.126.234 TCP 66 5201 → 45102 [ACK] Seq=1 Ack=4294917977 Win=4956 Len=0[Packet size limited during capture]
   72 0.030340191 130.215.248.198 → 130.215.126.234 TCP 66 5201 → 45102 [ACK] Seq=1 Ack=4294919347 Win=4979 Len=0[Packet size limited during capture]
   73 0.030351764 130.215.248.198 → 130.215.126.234 TCP 66 5201 → 45102 [ACK] Seq=1 Ack=4294920717 Win=5001 Len=0[Packet size limited during capture]
   74 0.030362963 130.215.248.198 → 130.215.126.234 TCP 66 5201 → 45102 [ACK] Seq=1 Ack=4294922087 Win=5024 Len=0[Packet size limited during capture]
   75 0.030374777 130.215.248.198 → 130.215.126.234 TCP 66 5201 → 45102 [ACK] Seq=1 Ack=4294923457 Win=5047 Len=0[Packet size limited during capture]
   76 0.030386096 130.215.248.198 → 130.215.126.234 TCP 66 5201 → 45102 [ACK] Seq=1 Ack=4294924827 Win=5069 Len=0[Packet size limited during capture]
   77 0.030397400 130.215.248.198 → 130.215.126.234 TCP 66 5201 → 45102 [ACK] Seq=1 Ack=4294926197 Win=5092 Len=0[Packet size limited during capture]
   78 0.030409373 130.215.248.198 → 130.215.126.234 TCP 66 5201 → 45102 [ACK] Seq=1 Ack=4294927567 Win=5114 Len=0[Packet size limited during capture]
   79 0.030420738 130.215.248.198 → 130.215.126.234 TCP 66 5201 → 45102 [ACK] Seq=1 Ack=4294928937 Win=5137 Len=0[Packet size limited during capture]
   80 0.030432559 130.215.248.198 → 130.215.126.234 TCP 66 5201 → 45102 [ACK] Seq=1 Ack=4294930307 Win=5160 Len=0[Packet size limited during capture]
   81 0.030444318 130.215.248.198 → 130.215.126.234 TCP 66 5201 → 45102 [ACK] Seq=1 Ack=4294931677 Win=5182 Len=0[Packet size limited during capture]
   82 0.030455560 130.215.248.198 → 130.215.126.234 TCP 66 5201 → 45102 [ACK] Seq=1 Ack=4294933047 Win=5205 Len=0[Packet size limited during capture]
   83 0.030470450 130.215.248.198 → 130.215.126.234 TCP 66 5201 → 45102 [ACK] Seq=1 Ack=4294934417 Win=5228 Len=0[Packet size limited during capture]
   84 0.030482183 130.215.248.198 → 130.215.126.234 TCP 66 5201 → 45102 [ACK] Seq=1 Ack=4294935787 Win=5250 Len=0[Packet size limited during capture]
   85 0.030494320 130.215.248.198 → 130.215.126.234 TCP 66 5201 → 45102 [ACK] Seq=1 Ack=4294937157 Win=5273 Len=0[Packet size limited during capture]
   86 0.030505976 130.215.248.198 → 130.215.126.234 TCP 66 5201 → 45102 [ACK] Seq=1 Ack=4294938527 Win=5295 Len=0[Packet size limited during capture]
   87 0.030517564 130.215.248.198 → 130.215.126.234 TCP 66 5201 → 45102 [ACK] Seq=1 Ack=4294939897 Win=5318 Len=0[Packet size limited during capture]
   88 0.030529092 130.215.248.198 → 130.215.126.234 TCP 66 5201 → 45102 [ACK] Seq=1 Ack=4294941267 Win=5341 Len=0[Packet size limited during capture]
   89 0.030540600 130.215.248.198 → 130.215.126.234 TCP 66 5201 → 45102 [ACK] Seq=1 Ack=4294942637 Win=5363 Len=0[Packet size limited during capture]
   90 0.030552186 130.215.248.198 → 130.215.126.234 TCP 66 5201 → 45102 [ACK] Seq=1 Ack=4294944007 Win=5386 Len=0[Packet size limited during capture]
   91 0.030563678 130.215.248.198 → 130.215.126.234 TCP 66 5201 → 45102 [ACK] Seq=1 Ack=4294945377 Win=5409 Len=0[Packet size limited during capture]
   92 0.030575242 130.215.248.198 → 130.215.126.234 TCP 66 5201 → 45102 [ACK] Seq=1 Ack=4294946747 Win=5431 Len=0[Packet size limited during capture]
   93 0.030586821 130.215.248.198 → 130.215.126.234 TCP 66 5201 → 45102 [ACK] Seq=1 Ack=4294948117 Win=5454 Len=0[Packet size limited during capture]
   94 0.030598368 130.215.248.198 → 130.215.126.234 TCP 66 5201 → 45102 [ACK] Seq=1 Ack=4294949487 Win=5476 Len=0[Packet size limited during capture]
   95 0.035955827 130.215.248.198 → 130.215.126.234 TCP 66 5201 → 45102 [ACK] Seq=1 Ack=4294950857 Win=5499 Len=0[Packet size limited during capture]
   96 0.047665918 130.215.248.198 → 130.215.126.234 TCP 66 5201 → 45102 [ACK] Seq=1 Ack=4294952227 Win=5522 Len=0[Packet size limited during capture]
   97 0.047685370 130.215.248.198 → 130.215.126.234 TCP 66 5201 → 45102 [ACK] Seq=1 Ack=4294953597 Win=5544 Len=0[Packet size limited during capture]
   98 0.047697670 130.215.248.198 → 130.215.126.234 TCP 66 5201 → 45102 [ACK] Seq=1 Ack=4294954967 Win=5567 Len=0[Packet size limited during capture]
   99 0.047710450 130.215.248.198 → 130.215.126.234 TCP 66 5201 → 45102 [ACK] Seq=1 Ack=4294956337 Win=5590 Len=0[Packet size limited during capture]
  100 0.047725806 130.215.248.198 → 130.215.126.234 TCP 66 5201 → 45102 [ACK] Seq=1 Ack=4294957707 Win=5612 Len=0[Packet size limited during capture]
  101 0.047736807 130.215.248.198 → 130.215.126.234 TCP 66 5201 → 45102 [ACK] Seq=1 Ack=4294959077 Win=5635 Len=0[Packet size limited during capture]
  102 0.047747741 130.215.248.198 → 130.215.126.234 TCP 66 5201 → 45102 [ACK] Seq=1 Ack=4294960447 Win=5657 Len=0[Packet size limited during capture]
  103 0.047758823 130.215.248.198 → 130.215.126.234 TCP 66 5201 → 45102 [ACK] Seq=1 Ack=4294961817 Win=5680 Len=0[Packet size limited during capture]
  104 0.047769614 130.215.248.198 → 130.215.126.234 TCP 66 5201 → 45102 [ACK] Seq=1 Ack=4294963187 Win=5703 Len=0[Packet size limited during capture]
  105 0.047780582 130.215.248.198 → 130.215.126.234 TCP 66 5201 → 45102 [ACK] Seq=1 Ack=4294964557 Win=5725 Len=0[Packet size limited during capture]
  106 0.047791478 130.215.248.198 → 130.215.126.234 TCP 66 5201 → 45102 [ACK] Seq=1 Ack=4294965927 Win=5748 Len=0[Packet size limited during capture]
  107 0.047802164 130.215.248.198 → 130.215.126.234 TCP 66 5201 → 45102 [ACK] Seq=1 Ack=1 Win=5771 Len=0[Packet size limited during capture]
  108 0.047813810 130.215.248.198 → 130.215.126.234 TCP 66 5201 → 45102 [ACK] Seq=1 Ack=949 Win=5786 Len=0[Packet size limited during capture]
  109 0.079225750 130.215.248.198 → 130.215.126.234 TCP 78 5201 → 45102 [ACK] Seq=1 Ack=949 Win=5786 Len=0[Packet size limited during capture]
  110 0.708493630 130.215.126.234 → 130.215.248.198 TCP 67 45092 → 5201 [PSH, ACK] Seq=1 Ack=1 Win=502 Len=1[Packet size limited during capture]
  111 0.715759784 130.215.248.198 → 130.215.126.234 TCP 67 5201 → 45092 [PSH, ACK] Seq=1 Ack=2 Win=508 Len=1[Packet size limited during capture]
  112 0.715854722 130.215.126.234 → 130.215.248.198 TCP 66 45092 → 5201 [ACK] Seq=2 Ack=2 Win=502 Len=0[Packet size limited during capture]
  113 0.716034182 130.215.126.234 → 130.215.248.198 TCP 70 45092 → 5201 [PSH, ACK] Seq=2 Ack=2 Win=502 Len=4[Packet size limited during capture]
  114 0.716063533 130.215.126.234 → 130.215.248.198 TCP 389 45092 → 5201 [PSH, ACK] Seq=6 Ack=2 Win=502 Len=323[Packet size limited during capture]
  115 0.721468036 130.215.248.198 → 130.215.126.234 TCP 66 5201 → 45092 [ACK] Seq=2 Ack=329 Win=506 Len=0[Packet size limited during capture]
  116 0.721530615 130.215.248.198 → 130.215.126.234 TCP 70 5201 → 45092 [PSH, ACK] Seq=2 Ack=329 Win=506 Len=4[Packet size limited during capture]
  117 0.721552806 130.215.248.198 → 130.215.126.234 TCP 373 5201 → 45092 [PSH, ACK] Seq=6 Ack=329 Win=506 Len=307[Packet size limited during capture]
  118 0.721571455 130.215.248.198 → 130.215.126.234 TCP 67 5201 → 45092 [PSH, ACK] Seq=313 Ack=329 Win=506 Len=1[Packet size limited during capture]
  119 0.721674255 130.215.126.234 → 130.215.248.198 TCP 66 45092 → 5201 [ACK] Seq=329 Ack=314 Win=501 Len=0[Packet size limited during capture]
  120 0.721714147 130.215.126.234 → 130.215.248.198 TCP 66 45102 → 5201 [FIN, ACK] Seq=949 Ack=1 Win=502 Len=0[Packet size limited during capture]
  121 0.721784021 130.215.126.234 → 130.215.248.198 TCP 67 45092 → 5201 [PSH, ACK] Seq=329 Ack=314 Win=501 Len=1[Packet size limited during capture]
  122 0.721808935 130.215.126.234 → 130.215.248.198 TCP 66 45092 → 5201 [FIN, ACK] Seq=330 Ack=314 Win=501 Len=0[Packet size limited during capture]
  123 0.741756694 130.215.248.198 → 130.215.126.234 TCP 66 5201 → 45102 [FIN, ACK] Seq=1 Ack=950 Win=5786 Len=0[Packet size limited during capture]
  124 0.741875635 130.215.126.234 → 130.215.248.198 TCP 66 45102 → 5201 [ACK] Seq=950 Ack=2 Win=502 Len=0[Packet size limited during capture]
  125 0.741921646 130.215.248.198 → 130.215.126.234 TCP 66 5201 → 45092 [FIN, ACK] Seq=314 Ack=330 Win=506 Len=0[Packet size limited during capture]
  126 0.741947449 130.215.126.234 → 130.215.248.198 TCP 66 45092 → 5201 [ACK] Seq=331 Ack=315 Win=501 Len=0[Packet size limited during capture]
  127 0.741957095 130.215.248.198 → 130.215.126.234 TCP 66 5201 → 45092 [ACK] Seq=315 Ack=331 Win=506 Len=0[Packet size limited during capture]
